{
  "result_kind": "amof_governed_workstation_bootstrap_contract",
  "contract_version": "2026-05-15",
  "bootstrap_status": "WARN",
  "generated_at": "2026-05-15T10:05:00Z",
  "target_workstation": {
    "os": "linux",
    "architecture": "x86_64",
    "shell": "/bin/bash",
    "layout_mode": "split_workspace",
    "required_local_tools": [
      "git",
      "python3"
    ],
    "optional_local_tools": [
      "docker",
      "k3d",
      "kubectl",
      "helm"
    ]
  },
  "source_repos": [
    {
      "name": "root",
      "role": "wrapper_config_audit_shell",
      "required": true,
      "path": "/workspace/amof-platform",
      "exists": true,
      "git_remote_url": "https://github.com/example/amof-platform.git",
      "current_branch": "feature/up10-lab",
      "current_head": "aaaaaaaaaaaaaaaaaaaaaaaaaaaaaaaaaaaaaaaa",
      "dirty_count": 7
    },
    {
      "name": "canonical_amof",
      "role": "canonical_active",
      "required": true,
      "path": "/workspace/amof-platform/repos/amof",
      "exists": true,
      "git_remote_url": "https://github.com/example/amof.git",
      "current_branch": "feature/up10-lab",
      "current_head": "bbbbbbbbbbbbbbbbbbbbbbbbbbbbbbbbbbbbbbbb",
      "dirty_count": 2
    },
    {
      "name": "canonical_ui",
      "role": "canonical_active",
      "required": false,
      "path": "/workspace/amof-platform/repos/amof-ui",
      "exists": true,
      "git_remote_url": "https://github.com/example/amof-ui.git",
      "current_branch": "main",
      "current_head": "cccccccccccccccccccccccccccccccccccccccc",
      "dirty_count": 0
    },
    {
      "name": "gmd_app",
      "role": "active_supporting",
      "required": false,
      "path": "/workspace/amof-platform/repos/gmd-app",
      "exists": true,
      "git_remote_url": "https://github.com/example/gmd-app.git",
      "current_branch": "main",
      "current_head": "dddddddddddddddddddddddddddddddddddddddd",
      "dirty_count": 0
    }
  ],
  "runtime_roots": {
    "config_root": {
      "path": "/tmp/amof-home/config",
      "purpose": "AMOF config, contexts, and registries",
      "exists": true,
      "writable": true,
      "outside_source_workspaces": true
    },
    "data_root": {
      "path": "/tmp/amof-home/share",
      "purpose": "AMOF durable app-data payloads",
      "exists": true,
      "writable": true,
      "outside_source_workspaces": true
    },
    "cache_root": {
      "path": "/tmp/amof-home/cache",
      "purpose": "AMOF cache and temporary downloads",
      "exists": true,
      "writable": true,
      "outside_source_workspaces": true
    },
    "state_root": {
      "path": "/tmp/amof-home/state",
      "purpose": "AMOF logs, queue state, and locks",
      "exists": true,
      "writable": true,
      "outside_source_workspaces": true
    },
    "evidence_dir": {
      "path": "/tmp/amof-home/share/evidence",
      "purpose": "Bootstrap and run evidence outputs",
      "exists": true,
      "writable": true,
      "outside_source_workspaces": true
    },
    "runs_dir": {
      "path": "/tmp/amof-home/share/runs",
      "purpose": "Run-level durable data",
      "exists": true,
      "writable": true,
      "outside_source_workspaces": true
    },
    "workspaces_dir": {
      "path": "/tmp/amof-home/share/workspaces",
      "purpose": "Per-run isolated workspace base directory",
      "exists": true,
      "writable": true,
      "outside_source_workspaces": true
    },
    "materialized_runs_dir": {
      "path": "/tmp/amof-home/share/workspaces/materialized-runs",
      "purpose": "Exact-SHA materialized workspace roots",
      "exists": true,
      "writable": true,
      "outside_source_workspaces": true
    },
    "receipts_dir": {
      "path": "/tmp/amof-home/share/receipts",
      "purpose": "Receipts and supporting bootstrap artifacts",
      "exists": true,
      "writable": true,
      "outside_source_workspaces": true
    },
    "logs_dir": {
      "path": "/tmp/amof-home/state/logs",
      "purpose": "Operational logs",
      "exists": true,
      "writable": true,
      "outside_source_workspaces": true
    },
    "locks_dir": {
      "path": "/tmp/amof-home/state/locks",
      "purpose": "Process coordination locks",
      "exists": true,
      "writable": true,
      "outside_source_workspaces": true
    },
    "queue_dir": {
      "path": "/tmp/amof-home/state/queue",
      "purpose": "Queued work state",
      "exists": true,
      "writable": true,
      "outside_source_workspaces": true
    },
    "tmp_dir": {
      "path": "/tmp/amof-home/cache/tmp",
      "purpose": "Temporary scratch directory",
      "exists": true,
      "writable": true,
      "outside_source_workspaces": true
    },
    "provider_profiles_dir": {
      "path": "/tmp/amof-home/config/provider-profiles",
      "purpose": "Provider profile references",
      "exists": true,
      "writable": true,
      "outside_source_workspaces": true
    }
  },
  "forbidden_state_roots": [
    "/workspace/amof-platform",
    "/workspace/amof-platform/repos/amof",
    "/workspace/amof-platform/repos/amof-ui",
    "/workspace/amof-platform/repos/gmd-app"
  ],
  "provider_authority": {
    "current_context": "local",
    "controlplane_mode": "local-cli",
    "execution_backend": "local",
    "workspace_backend": "local-appdata",
    "evidence_backend": "local-appdata",
    "provider_profile_refs": [],
    "provider_profile_ref_count": 0,
    "provider_health_status": "unconfigured",
    "kubeconfig_ref": null,
    "kubeconfig_ref_exists": null,
    "redaction_rules": [
      "do not record raw API keys or bearer tokens",
      "do not record kubeconfig contents or private SSH keys",
      "record only provider profile refs, secret names, boolean presence, and health classifications"
    ]
  },
  "director_prerequisites": {
    "cli_import_is_canonical": true,
    "required_contracts_available": true,
    "isolated_workspace_base_dir": "/tmp/amof-home/share/workspaces",
    "materialized_runs_dir": "/tmp/amof-home/share/workspaces/materialized-runs",
    "artifact_directory": "/tmp/amof-home/share/evidence",
    "runtime_roots_outside_source_workspaces": true,
    "provider_resolution_status": "unconfigured",
    "doctor_surface": "amof doctor --json",
    "bootstrap_contract_surface": "amof bootstrap contract --json"
  },
  "doctor_gates": [
    {
      "name": "canonical_import_resolution",
      "status": "PASS",
      "summary": "Runtime import must resolve under the canonical AMOF scripts path.",
      "evidence": "/workspace/amof-platform/repos/amof/scripts/amof/__init__.py"
    },
    {
      "name": "git_dirty_classification",
      "status": "WARN",
      "summary": "Dirty state is preserved as evidence and must not be silently normalized.",
      "evidence": "root=7, canonical_amof=2"
    },
    {
      "name": "runtime_roots_outside_source_workspaces",
      "status": "PASS",
      "summary": "All runtime roots must be writable and remain outside mutable source workspaces.",
      "evidence": "/tmp/amof-home/share/workspaces"
    },
    {
      "name": "required_contracts_available",
      "status": "PASS",
      "summary": "Bootstrap and Director contract schemas must be present in the canonical repo.",
      "evidence": "contracts/director-intake-client-contract.md, contracts/director-intake-execution-contract.schema.json, contracts/director-plan-result.schema.json, contracts/execution-handoff-result.schema.json, contracts/workspace-receipt.schema.json"
    },
    {
      "name": "required_toolchain_present",
      "status": "PASS",
      "summary": "Required bootstrap toolchain commands must be installed and runnable.",
      "evidence": "git=git version 2.43.0, python=Python 3.12.3"
    },
    {
      "name": "optional_local_runtime_tools",
      "status": "WARN",
      "summary": "Optional local-runtime tools may remain WARN when local runtime proof is deferred.",
      "evidence": "docker=available, k3d=missing, kubectl=available, helm=missing"
    },
    {
      "name": "provider_authority_by_reference",
      "status": "WARN",
      "summary": "Provider authority must be described by references and redacted metadata, not raw secrets.",
      "evidence": "provider_profile_ref_count=0; health=unconfigured"
    },
    {
      "name": "secret_exposure_sanity_check",
      "status": "PASS",
      "summary": "Obvious secret-bearing files inside the canonical source tree block bootstrap readiness.",
      "evidence": "finding_count=0"
    }
  ],
  "evidence_outputs": {
    "contract_artifact_path": "/tmp/amof-home/share/evidence/bootstrap/local/governed-workstation-bootstrap-contract.json",
    "bootstrap_command": "amof bootstrap bundle --json",
    "bundle_directory": "/tmp/amof-home/share/evidence/bootstrap/local/20260515T100500Z",
    "doctor_command": "amof doctor --json",
    "artifact_paths": {
      "contract_artifact_path": "/tmp/amof-home/share/evidence/bootstrap/local/20260515T100500Z/governed-workstation-bootstrap-contract.json",
      "doctor_artifact_path": "/tmp/amof-home/share/evidence/bootstrap/local/20260515T100500Z/doctor.json",
      "source_checkout_receipt_path": "/tmp/amof-home/share/evidence/bootstrap/local/20260515T100500Z/bootstrap-source-checkout-receipt.json",
      "toolchain_receipt_path": "/tmp/amof-home/share/evidence/bootstrap/local/20260515T100500Z/bootstrap-toolchain-receipt.json",
      "provider_configuration_receipt_path": "/tmp/amof-home/share/evidence/bootstrap/local/20260515T100500Z/bootstrap-provider-configuration-receipt.json",
      "failure_receipt_path": null,
      "summary_artifact_path": "/tmp/amof-home/share/evidence/bootstrap/local/20260515T100500Z/up10-bootstrap-summary.json",
      "sha256_manifest_path": "/tmp/amof-home/share/evidence/bootstrap/local/20260515T100500Z/bootstrap-sha256-manifest.json"
    },
    "sha256_manifest_path": "/tmp/amof-home/share/evidence/bootstrap/local/20260515T100500Z/bootstrap-sha256-manifest.json",